	Term_NDoc_Date	Sentence	Frame
400	18_120_2015-09-09	Wir müssen aber, um dies sinnvoll und effizient zu gestalten, auch dafür sorgen, dass wir schnellere Asylverfahren bekommen.	x
401	18_120_2015-09-09	Ich will all das unterstreichen, was zur Bekämpfung der Fluchtursachen gesagt wurde.	x
402	18_120_2015-09-09	Ich denke an das Thema Integrationskurse, für die wir mehr Plätze brauchen, weil es schon jetzt ein Rekordinteresse an diesen Plätzen gibt.	x
403	18_120_2015-09-09	Ich bin auch der Meinung, dass wir uns bei den Beratungen im Haushaltsausschuss noch einmal genau anschauen sollten, ob wir nicht noch mehr tun können, ob wir nicht noch entschiedener vorgehen können gegen die Schleuserbanden, gegen diese Schlepperorganisationen und ob wir das Bundeskriminalamt an dieser Stelle nicht etwas besser ausstatten.	x
404	18_120_2015-09-09	Gute Entwicklungszusammenarbeit ist vor allem dann gegeben, wenn sie Menschen Lebensperspektiven in ihrer Heimat gibt und somit Fluchtursachen minimiert werden können.	x
405	18_120_2015-09-09	Flucht, Asyl und Integration von Menschen, die zu uns kommen und dann nach der Anerkennung eine Chance haben sollen, über Arbeit, Soziales sozusagen voll in diese Gesellschaft aufgenommen zu werden und Teil dieser Gesellschaft zu werden.	1.6
406	18_120_2015-09-09	Aus dieser ökonomischen Stärke – die korrespondiert mit den Zahlen des Bundeshaushalts – erwächst eine besondere Verantwortung Deutschlands – nicht Deutschlands allein –, die Integration der Menschen positiv zu befördern.	x
407	18_120_2015-09-09	Mir tut es im Herzen und im Glauben weh, dass die Staatschefs aus Polen, der Slowakei, aus Tschechien und Ungarn, die sich am letzten Freitag in Prag getroffen haben, im Brustton der Überzeugung sagen, sie wollen sich an dieser Integrationsarbeit nicht beteiligen.	x
408	18_120_2015-09-09	Gerade die Flucht-, Asyl- und Integrationsfragen, Frau Präsidentin, können nur gelöst werden, indem wir in Deutschland Milliarden von privatem Kapital mit öffentlicher Unterstützung für sozialen Wohnungsbau verwenden, der sich an den Bedürfnissen der Menschen orientiert, egal ob die Menschen hier schon lange leben oder jetzt kommen.	x
409	18_120_2015-09-09	Das ist vor allen Dingen auch eine kulturpolitische Herausforderung, zunächst einmal, weil kulturelle Teilhabe eine grundlegende Voraussetzung dafür ist, dass Zuwanderer in der Fremde ihre neue Umgebung verstehen und dass auch sie hier verstanden werden, weil kulturelle Teilhabe eben auch gesellschaftliche Teilhabe ist, aber auch, weil die diffuse Angst vor den Fremden, wie  Ewald Schurer  Deutscher Bundestag – 18.	x
410	18_120_2015-09-09	Ich begrüße daher ausdrücklich die Initiativen aus dem kulturellen Bereich unterschiedlicher Art und Weise wie zum Beispiel die des deutschen Buchhandels zur Unterstützung der kulturellen Angebote insbesondere für Asylsuchende und Flüchtlinge, die unter der Schirmherrschaft von Navid Kermani steht.	1.6
411	18_120_2015-09-09	Die Staatsministerin hat gesagt, dass wir Projekte und Initiativen stärken müssen, die sich mit der kulturellen Einbindung von Migranten beschäftigen.	1.6
412	18_120_2015-09-09	Meine Damen und Herren, aber auch bei der Bewältigung der Fluchtursachen ist eine weitere europäische Komponente gefordert.	x
413	18_120_2015-09-09	Dies ist ein entscheidender Beitrag, Fluchtursachen zu verhindern.	x
414	18_120_2015-09-09	Wenn es darum geht, Fluchtursachen zu beseitigen, ist es meines Erachtens entscheidend, für eine Entwicklung in Libyen hin zur Stabilität zu sorgen.	x
415	18_120_2015-09-09	Wenn wir über Fluchtursachen sprechen, müssen wir natürlich auch einen vernetzten Ansatz im Blick haben.	x
416	18_120_2015-09-09	Sie haben vorhin über die Mission gesprochen, die die Europäische Union verabredet hat, um gegen die sogenannten Schlepper militärisch vorzugehen.	x
417	18_120_2015-09-09	Sie sprachen davon, Schlepperbanden würden unter Inkaufnahme des Todes ihr Geld machen.	2.5
418	18_120_2015-09-09	Auch das hat etwas mit dem Thema „Beseitigung von Fluchtursachen“ zu tun.	x
419	18_120_2015-09-09	Ich möchte allen Soldatinnen und Soldaten herzlich danken, die einen Beitrag zur Ausbildung im Irak, zu einem wirkungsvollen Entgegentreten gegen den ISIS-Terror und somit zur Beseitigung von Fluchtursachen leisten.	x
420	18_120_2015-09-09	Man darf aber nicht verkennen, dass es die Bürgerinnen und Bürger zurzeit als besonders wichtig und notwendig ansehen, einen Beitrag zur Beseitigung der Fluchtursachen zu leisten.	2.3
421	18_120_2015-09-09	Kolleginnen und Kollegen, alle sprechen jetzt darüber, dass es darum gehen muss, Fluchtursachen zu beseitigen.	x
422	18_120_2015-09-09	Da geht es auch um die Beseitigung von Fluchtursachen.	x
423	18_120_2015-09-09	Die Bekämpfung der Fluchtursachen ist das Ziel der Bundesregierung.	x
424	18_120_2015-09-09	Aber dass die Bekämpfung der Fluchtursachen das zentrale Ziel der Regierungspolitik ist, steht, glaube ich, außer Zweifel.	x
425	18_120_2015-09-09	Dafür brauchen wir – Stichwort Bekämpfung der Fluchtursachen – den langen Atem, und den haben wir in dieser Großen Koalition.	x
426	18_120_2015-09-09	Fluchtursachen muss man bekämpfen und nicht die Flüchtenden.	x
427	18_120_2015-09-09	Denn dann sind wir in der Lage, einen Beitrag zu leisten, die Fluchtursachen, insbesondere was Afrika angeht, mittelund langfristig zurückzudrängen.	x
428	18_120_2015-09-09	Auch wenn wir den Bürgerinnen und Bürgern ein Gefühl dafür geben wollen, dass wir mit der außenpolitischen Aufgabe der Bekämpfung der Fluchtursachen verantwortungsvoll umgehen, werden wir ihnen natürlich nicht für jedes Problem eine Lösung servieren können.	x
429	18_120_2015-09-09	Gerade mit Blick auf die Flüchtlinge und die Fluchtursachen haben wir die Chance, auf dem EU-Gipfel im nächsten Jahr diesbezüglich einen mächtigen Akzent zu sehen und diejenigen positiv zu überraschen, die sich von der Europäischen Union in diesem Punkt nicht so viel erwarten.	x
430	18_120_2015-09-09	Die Prog nose von bis zu 800 000 Flüchtlingen, die in diesem Jahr nach Deutschland kommen und Asyl beantragen könnten, beruht ganz wesentlich auch auf der bereits diskutierten Situation in Syrien.	x
431	18_120_2015-09-09	Ganz wesentlicher Bestandteil deutscher Politik, aber auch deutscher Außenpolitik – das hat man früher nicht so gesehen – ist die Bekämpfung von Fluchtursachen.	x
432	18_120_2015-09-09	Die regionalen Fluchtursachen im Mittleren Osten kann man nur wirksam bekämpfen, wenn der IS-Terrorismus ausgelöscht wird.	2.1
433	18_120_2015-09-09	Aber mit dem IS-Terrorismus werden wir keine politische Lösung hinbekommen.	x
434	18_120_2015-09-09	Eins zu eins umgesetzt würde diese Vorschrift für Deutschland bedeuten – Herr Präsident, ich bemühe mich, gleich zum Schluss zu kommen –, dass wir 3 000 Flüchtlinge im Jahr hätten, während Griechenland 300 000 Asylanträge bearbeiten müsste.	x
435	18_120_2015-09-09	Die Fraktionsvorsitzende der Grünen hat im Zusammenhang mit der Schlepperbekämpfung gesagt, wir sollten nicht „Schiffe versenken“ spielen.	x
436	18_120_2015-09-09	Mir ist aber wichtig, dass Sie sich wie auch ich in den letzten Wochen und Monaten informieren über die Art dieser Mission, über die Erkenntnisse, die wir inzwischen gewonnen haben, über die Netze organisierter Kriminalität der Schlepper und Schleuser, die dort ihr Unwesen treiben.	2.1
437	18_120_2015-09-09	Es ist natürlich nicht die Lösung, damit sind natürlich nicht die Fluchtursachen beseitigt, aber es ist ein gewichtiges Mittel, da die Schlepper und Schleuser im System organisierter Kriminalität brutalst vorgehen und Milliar Alois Karl  Deutscher Bundestag – 18.	2.1
438	18_120_2015-09-09	Ein Teil dieser Flüchtlinge versucht, mit Schlepperbooten über das Mittelmeer nach Europa zu kommen.	x
439	18_120_2015-09-09	Man kann Europa nicht abriegeln, weder mit Stacheldraht noch mit Mauern – und im Übrigen auch nicht mit einem Kampfeinsatz gegen Schlepper.	x
440	18_120_2015-09-09	Die Flüchtlinge und Asylbewerber in Deutschland müssen mit der gebotenen Menschenwürde angenommen werden.	1.1
441	18_120_2015-09-09	Ein voranmarschierender IS-Terrorismus – Sie sagen es, Frau Keul – muss mit allen Mitteln gestoppt werden.	x
442	18_120_2015-09-09	Aber wenn wir das ernst meinen – wir meinen es alle ernst –, dass die Fluchtursachen langfristig nur in den Krisenregionen bekämpft werden können, dann müssen wir uns auch dazu bekennen, dass alle Etats in unserem Haushalt, die sich um die internationale Verantwortung kümmern – humanitäre Hilfe, Polizeiausbildung, wirtschaftliche Zusammenarbeit, aber auch der Etat für Verteidigung –, in den nächsten Jahren deutlicher anwachsen müssen, um dieser Verantwortung gerecht zu werden.	x
443	18_120_2015-09-09	Wer Waffen liefert, schafft Gewalt und neue Fluchtursachen, statt sie zu beseitigen.	x
444	18_120_2015-09-09	Wenn vom Fraktionsvorsitzenden der SPD und vielen anderen gesagt wird, der Müller könne doch jetzt alles in die Bekämpfung von Fluchtursachen investieren, muss ich sagen, dass das natürlich nicht geht.	x
445	18_120_2015-09-09	Wer Zukunft, Arbeit und Lebensperspektive für sich sieht, der begibt sich nicht in die Hände von Schleppern.	x
446	18_120_2015-09-09	Krieg ist Fluchtursache Nummer eins.	x
447	18_120_2015-09-09	Eine Ihrer Sonderinitiativen heißt „Fluchtursachen bekämpfen – Flüchtlinge reintegrieren“.	x
448	18_120_2015-09-09	Wo kann die Entwicklungszusammenarbeit ansetzen, um Fluchtursachen wirkungsvoll entgegenzutreten?	x
449	18_120_2015-09-09	Auch ich bin der Meinung, dass wir diesen Fokus im kommenden Haushaltsjahr auf die Fluchtursachen richten müssen.	x
