	Term_NDoc_Date	Sentence	Frame
15	18_127_2015-10-01	Ich will zur Flüchtlingsdebatte nicht sehr viel sagen, aber ich will sagen, dass wir versuchen müssen, den Menschen die Chance zu geben, auf eine vernünftige Art und Weise zu uns zu kommen, auch um Zuwanderung steuern zu können.	x
16	18_127_2015-10-01	Einige der Gründe für die Flucht finden wir im Menschenrechtsbericht, doch wesentliche Aspekte der Fluchtursachen bleiben ausgeblendet.	x
17	18_127_2015-10-01	Der Kli­ mawandel wird durch die Industrienationen wesentlich mitverursacht und führt zu neuen Fluchtursachen in der  Frank Schwabe  Deutscher Bundestag – 18.	2.1
18	18_127_2015-10-01	Die Linke fordert deswegen, dass in den künftigen Berichten die europäische Flüchtlingspolitik und die Fluchtursachen in einem eigenen Kapitel ehrlich aufgearbeitet werden.	x
19	18_127_2015-10-01	Neben der großen Hilfsbereitschaft gibt es in Deutsch­ land leider auch einen tief verankerten Rassismus in der Bevölkerung und bei staatlichen Institutionen.	1.3
20	18_127_2015-10-01	Die aktuellen Migrantenströme zeigen die Anziehungskraft unseres Landes.	x
21	18_127_2015-10-01	Mehr noch: Die Europäi­ sche Union hat seit Jahren die katastrophale Flüchtlings­ lage in Griechenland und in Italien – wie oft haben wir uns im Menschenrechtsausschuss mit dieser Thematik auseinandergesetzt – fahrlässig, ja sträflich hingenom­ men und damit dazu beigetragen, dass sich die Karawa­ ne der Migranten heute in Richtung Europa, in Richtung Deutschland bewegt.	2.4
22	18_127_2015-10-01	Nicht alle, die kommen, haben Anspruch auf Asyl, und nicht alle werden bleiben können.	4.2
23	18_127_2015-10-01	Es bleibt eine schwierige – auch das will ich sagen –, aber dennoch richtige Entscheidung, dass im aktuellen Asylkompromiss drei sichere Länder ohne politische Verfolgung auch von uns als sichere Herkunftsländer ein­ gestuft werden.	x
24	18_127_2015-10-01	Das gilt sowohl für die Anwendung des Asylrechts als auch für die anderen Rechtsnormen.	1.1
25	18_127_2015-10-01	Und Deutschland und Europa schützt man nicht vor ungebremster Zuwanderung, indem man Grenzen verdichtet, eine harte Rhetorik auflegt und die Probleme konsequent ignoriert.	x
26	18_127_2015-10-01	Neben europäischer Solidarität bei der Aufnahme von Flüchtlingen sind vor allem entschlossene außenpoliti­ sche Ansätze gefordert, die eine spürbare Verbesserung der Situation nicht nur in den Herkunftsländern, sondern auch in den angrenzenden Schutzgebieten bringen und damit das Problem der Sekundärmigration, für das unser Asylrecht schon laut Definition nun überhaupt nicht ge­ dacht ist, endlich an der Wurzel angehen.	x
27	18_127_2015-10-01	Die Menschen begeben sich in die Hände von kriminellen Schleppern, die sie auf seeuntüchtigen Boo­ ten auf den Weg nach Europa schicken.	2.4
28	18_127_2015-10-01	Fluchtursachen lassen sich nicht von heute auf morgen bekämpfen.	x
29	18_127_2015-10-01	Zu die­ sem Werkzeugkasten gehört zweifelsohne ein umfassen­ des Zuwanderungsgesetz, das Flüchtlingen legale Mög­ lichkeiten für einen Neustart in Deutschland bietet.	x
30	18_127_2015-10-01	Ich finde, es ist vielsagend, wenn nur halb­ herzig über die Fluchtursachen gesprochen wird.	x
31	18_127_2015-10-01	Ein Ansatz ist die Mission EUNAVFOR MED, bei der es in der ersten Phase um die Aufklärung der Schlep­ pernetzwerke ging, und bei der es jetzt darum geht, die Schlepperboote und das Netzwerk der Beobachter der Schlepper auf dem Mittelmeer auszuheben.	2.4
32	18_127_2015-10-01	Wir müssen neben der Fluchtursachenbekämp­ fung – ich komme nachher darauf zurück – im nördlichen Afrika Einrichtungen schaffen, in denen die Flüchtlinge sichere Aufenthaltsorte bekommen.	x
33	18_127_2015-10-01	Ich möchte dafür werben, dass wir alles daranset­ zen, auch unserer Öffentlichkeit zu erklären, dass wir die Ursachenbekämpfung angehen, aber auch die ärgste Not lindern müssen, indem wir die Flüchtlinge aus den Schlepperbooten befreien und auf den Boden der Euro­ päischen Union bringen.	2.4
34	18_127_2015-10-01	Es ist aber ein notwendiger Schritt, um das Schleppernetzwerk lahm­ zulegen.	x
35	18_127_2015-10-01	Na­ türlich gibt es das Risiko der bewaffneten Auseinander­ setzung zwischen militärischen Kräften und Schleppern.	x
36	18_127_2015-10-01	Sie wollen am libyschen Festland und in libyschen Küstengewässern gezielt gegen die Infrastruktur der Schlepper vorgehen.	x
37	18_127_2015-10-01	Na­ türlich sind die Schlepper grausame Menschen, die ein schlimmes Geschäft mit dem Leid der Flüchtlinge be­ treiben.	2.2
38	18_127_2015-10-01	Aber statt eine Mission auf den Weg zu bringen, die einerseits riskant ist, aber andererseits ihre Ziele nicht erreichen wird, gibt es einen sicheren und effektiveren Weg, den Schleppern die Geschäftsgrundlage zu entziehen, nämlich endlich legale und sichere Einwanderungswege nach Europa zu schaffen.	2.4
39	18_127_2015-10-01	Wir wollen legale und sichere Einwanderungswege und vor allem endlich eine engagierte und effektive Seenotrettung.	2.4
40	18_127_2015-10-01	Unsere größte Herausforderung in Europa sind aber nicht die Schulden, sondern der ungebremste Zustrom von Migranten und Flüchtlingen.	4.1
41	18_127_2015-10-01	Seit Januar 2015 sind eine halbe Million Migranten und Flüchtlinge mithilfe von Schleuserbanden über das Mittelmeer nach Europa gekommen.	2.4
42	18_127_2015-10-01	Es geht nicht um die Frage, ob wir Seenot­ rettung oder Bekämpfung der Schlepperbanden wollen.	2.4
43	18_127_2015-10-01	Es wird hier behauptet, es soll zukünftig darum gehen, dass die Boote der Schlepper versenkt werden.	x
44	18_127_2015-10-01	Es geht darum, dass Schlepper identifi­ ziert werden sollen, dass sie erkennungsdienstlich behan­ delt werden sollen, dass die Routen erkannt werden und dass Boote beschlagnahmt werden können.	x
45	18_127_2015-10-01	Niemand hat behauptet, dass mit die­ sem Mandat die Fluchtursachen bekämpft werden sollen.	x
46	18_127_2015-10-01	Wenn man sich anschaut, was wir als Koalitionsfraktionen und die Bundesregierung sonst noch unternehmen, dann finde ich es töricht, wenn man behauptet, wir würden uns nicht um die Bekämp­ fung der Fluchtursachen kümmern.	x
47	18_127_2015-10-01	Meine Fraktion, die SPD, setzt sich dafür ein, dass wir in Deutschland ein Einwanderungsgesetz bekom­ men, das den Menschen zeigt, wie sie nach Deutschland kommen können.	x
48	18_127_2015-10-01	Ich würde mir wünschen, dass sich auch andere Fraktionen hier im Parlament bewegen, da­ mit wir schnell ein solches wichtiges Einwanderungsge­ setz bekommen.	x
49	18_127_2015-10-01	Hier beobachten unsere Einsatzkräfte Tag für Tag, wie skrupellose Schlepper ihrem Geschäft nachge­ hen und aus der Not ihrer Opfer Profit schlagen.	2.2
0	18_127_2015-10-01	Der Übergang zu Phase 2 i) bedeutet nun, nach der Informa­ tionsgewinnung gezielt gegen die Schlepper vorzugehen.	x
1	18_127_2015-10-01	Schlepperboote können auf hoher See aufgebracht und beschlagnahmt werden.	x
2	18_127_2015-10-01	Es liegt auch im Interesse der Flüchtlinge und von uns allen, damit die­ se lebensgefährlichen Schlepperfahrten ihre Ausgangs­ basis verlieren.	2.4
3	18_127_2015-10-01	Zum einen geht es um die Bewältigung ihrer Auswirkungen hier bei uns, zum anderen um die Bekämpfung der Fluchtursachen.	4.1
4	18_127_2015-10-01	Daneben geht es aber auch – das sollten wir nicht verges­ sen – um die Situation in den Transitländern, und damit geht es darum, wie wir den Schleppern ihre menschen­ verachtende Arbeit unmöglich machen.	2.2
5	18_127_2015-10-01	Es geht dabei um eine vernetzte Gesamtstrategie, die sowohl die Herkunfts­ und Nachbarländer als auch die Schlepperorganisationen gezielt ins Visier nimmt.	x
6	18_127_2015-10-01	Es kann und darf nicht sein, dass zum Beispiel Schlepper vor den Augen unserer Einsatzkräfte ihre Boo­  te wieder einsammeln, um sie erneut mit Flüchtlingen vollzustopfen.	2.2
7	18_127_2015-10-01	Kultur dient auch der Integration.	x
8	18_127_2015-10-01	Kultur kann gerade im ländlichen Raum zur Integration von Flüchtlingen genutzt werden.	x
9	18_127_2015-10-01	Kolleginnen und Kollegen, Schlüsselfaktor kul­ tureller Integration ist die kulturelle Bildung.	x
10	18_127_2015-10-01	Bisher beschäf­ tigt sich aber lediglich eine von zehn Arbeitsgruppen des Strategiekongresses Demografie mit Einwanderung.	x
11	18_127_2015-10-01	Inte­ gration heißt auch, kulturelle Werte und Traditionen zu vermitteln, und zwar in beide Richtungen: von uns auf die Flüchtlinge und Migranten und von den Flüchtlingen und Migranten auf uns.	x
12	18_127_2015-10-01	Und, weil das Thema in den letzten Tagen aufgekommen ist: Wer glaubt, er könne beim Mindestlohn Migranten gegen andere Arbeitnehmer ausspielen, ist ein sozialer Brandstifter.	4.4
13	18_127_2015-10-01	Dies erfordert von der Völkergemeinschaft insbesondere die Bekämpfung von Fluchtursachen, die häufig in Kriegs-bzw.	2.1
14	18_127_2015-10-01	Aber auch für Flüchtlinge, die heute in ihrer akuten Not Hilfe bei Schlepperbanden suchen, brauchen wir Antworten – solange Fluchtursachen nicht wirksam be­ seitigt wurden.	2.1
15	18_127_2015-10-01	Ein Kampf gegen Schlepperbanden muss gleichziehen mit dem Einsatz zur Schaffung legaler Fluchtwege.	x
16	18_127_2015-10-01	Andernfalls wird an anderen Orten als unse­ ren Grenzen unser Asylrecht ausgehöhlt.	x
17	18_127_2015-10-01	Schlepperbanden unterscheiden sich von Fluchthel­ fern, indem sie den Tod von Hilfe suchenden Menschen ausnutzen, Leib und Leben dieser Menschen riskieren oder gar ihren Tod einkalkulieren.	2.4
18	18_127_2015-10-01	Schlepperbanden auch mit militä­ rischen Mitteln zu begegnen, halte ich mit Blick auf un­ sere humanitäre Schutzpflicht gegenüber den flüchtenden Menschen somit prinzipiell für opportun und notwendig.	x
19	18_127_2015-10-01	Ich begrüße es somit, wenn die Europäische Union Maßnahmen gegen Schlepperkriminalität ergreift und Menschenhandel sanktioniert.	x
20	18_127_2015-10-01	Nicht Sanktionen, bürokratische Zumutungen und Gängelung, sondern faire Spielre­ geln, Motivation und Bestärkung der Arbeitsuchenden müssen die Integrationsarbeit in den Jobcentern be­ stimmen.	1.1
21	18_128_2015-10-02	Die immensen Anstrengungen der Menschen in Ostdeutschland, die Solidarität der Bürger in Westdeutschland, die Integration eines vereinigten Deutschlands  Deutscher Bundestag – 18.	1.2
22	18_128_2015-10-02	Wir müssen deswegen Zuwanderung begrenzen.	x
23	18_128_2015-10-02	Danke, dass dieser Begriff der Leitkultur inzwischen auch von anderen Parteien dieses Hauses ganz selbstverständlich gebraucht wird.	x
24	18_128_2015-10-02	Oktober 201512436  (A) (C)  (B) (D)  Leitkultur, der Gültigkeit hat, nun auch zur Selbstverständlichkeit in anderen Parteien geworden ist.	x
25	18_128_2015-10-02	Zu den großen Erfolgen der deutschen Einheit gehört zweifellos die Integration Ostdeutschlands in die sozialen Sicherungssysteme der alten Bundesrepublik.	1.2
26	18_128_2015-10-02	Denn viele der Krisen, die wir heute als humanitäre Krisen erleben, sind ja, wie es der Bundesaußenminister immer sagt, auch Krisen der Humanität, also der Menschlichkeit, die in Gefahr ist aufgrund von Terrorismus, ideologischem Radikalismus und auch aufgrund der Situation, dass in immer mehr Staaten jede zivile Ordnung auseinanderbricht und dass gerade in den Krisenregionen dem staatlichen Gewaltmonopol überhaupt keine Bedeutung mehr zukommt.	x
27	18_128_2015-10-02	Denken wir an die Diskussionen, die wir derzeit über eine gerechte Behandlung der Flüchtlinge und eine wirklich europäische Flüchtlingsund Asylpolitik führen.	2.2
28	18_128_2015-10-02	Sie teilt Asylsuchende in vermeintlich gute und schlechte Flüchtlinge ein, in potenzielle Fachkräfte und Unqualifizierte und plant weitere Abschreckungsmaßnahmen.	2.2
29	18_128_2015-10-02	Fluchtursachen bekämpfen wir am besten, wenn wir Menschen nicht nur ein Bett, ein Dach und etwas zu essen geben, sondern wenn wir ihnen auch eine Perspektive geben: auf ein sicheres Leben, auf Bildung und auf Arbeit – in ihren Heimatländern, aber auch denjenigen, die bei uns bleiben.	x
30	18_128_2015-10-02	Sie können bei Sprachvermittlung und Integration helfen.	x
31	18_128_2015-10-02	Auch in meinem Wahlkreis Herne-Bochum II haben wir Asylsuchende aufgenommen  Vizepräsidentin Claudia Roth  Deutscher Bundestag – 18.	x
32	18_128_2015-10-02	All das, was im Zuge des Kolonialismus in die Sammlungen der deutschen Völkerkundemuseen gelangte und was als geteiltes Erbe einfach hierbleiben sollte?	x
33	18_128_2015-10-02	Ich will ein drittes Problem nennen: die aus der DDR Geflüchteten, Abgeschobenen und Ausgereisten.	1.2
34	18_128_2015-10-02	Aber die Auswirkungen der notwendigen Maßnahmen haben auch viele Berührungspunkte mit der Familien-, der Integrations- und der Arbeitsmarktpolitik.	x
35	18_128_2015-10-02	Die touristischen Ziele in den Alpen haben die gleichen Probleme wie wir: demografische Entwicklung, Umweltbelastungen, zu viel Zuzug von Neubürgern und zu viel Wegzug von Leuten, die dort aufgewachsen sind und mal gedacht haben, sie könnten sich dort ihre Zukunft aufbauen.	x
36	18_128_2015-10-02	Da will zum Beispiel eine CSU-Landesgruppenchefin Menschen abschieben, bevor sie überhaupt in Deutschland angekommen sind, da will ein Ministerpräsident aus Sachsen-Anhalt Schutzsuchende benutzen, um den Mindestlohn zu untergraben, und da will ein Finanzminister aus Bayern Zäune zur Flüchtlingsabwehr an den deutschen Grenzen errichten.	2.5
37	18_128_2015-10-02	Eine der großen, vielleicht sogar die größte Herausforderung bei der Integration von Flüchtlingen ist der offene und schnelle Zugang zu Bildung und Ausbildung.	x
38	18_128_2015-10-02	Der Zugang zu Bildung ist ja keine kleine Fußnote in einer allgemeinen Flüchtlingsagenda, sondern Bildung – davon sind wir überzeugt – ist der zentrale Dreh- und Angelpunkt jeder gelungenen Asyl- und Integrationspolitik.	x
39	18_128_2015-10-02	Asylsuchende und Geduldete sind hier immer noch stark benachteiligt.	1.1
40	18_128_2015-10-02	Und Integration durch Bildung – da sind wir uns mit den Antragstellern der beiden Anträge, die heute vorliegen, einig –,  (Beifall des Abg.	x
41	18_128_2015-10-02	Wenn es gelingt, Integration so zu vollziehen, wie wir das vorhaben, dann profitieren alle davon, und zwar nicht nur der Arbeitsmarkt, sondern das ganze Land.	3
42	18_128_2015-10-02	Die 130 Millionen Euro für die Integration junger Flüchtlinge legen wir aber sofort auf den Tisch.	x
43	18_128_2015-10-02	Erwerb der deutschen Sprache, Erkennen der Kompetenzen, also was Ausbildungen, was Qualifikationen hier in Deutschland wert sind und was man damit machen kann, und natürlich Integration in Ausbildung oder Beruf.	x
44	18_128_2015-10-02	Dort motiviert man beispielsweise Unternehmer mit Migrationshintergrund, etwa türkische Gemüsehändler, junge Leute auszubilden.	x
45	18_128_2015-10-02	Oktober 201512490  (A) (C)  (B) (D)  und stattdessen, auch im Rahmen der Allianz für Ausund Weiterbildung, Maßnahmen zur Integration von Geflüchteten angekündigt hat.	x
46	18_128_2015-10-02	Ich erwarte von der Bildungsministerin auch mal ein paar klare Worte, wenn hierzulande Flüchtlingskinder von der Polizei mitten aus dem Unterricht geholt werden, weil den Eltern die Abschiebung droht,  (Beifall bei der LINKEN)  oder wenn so unglaubliche Vorschläge gemacht werden wie der, die Schulpflicht für Kinder von Asylbewerbern gleich ganz abzuschaffen.	2.5
47	18_128_2015-10-02	Mal sind es die Asylsuchenden insgesamt, dann versucht man, Menschen über die Konstruktion von sogenannten sicheren Herkunftsstaaten von Arbeit und Bildung auszuschließen.	x
48	18_128_2015-10-02	Öffnung von Integrations- und Sprachkursen,  (Dr.	x
49	18_128_2015-10-02	Die Frage ist also, wie Integration gemeinsam erfolgreich gestaltet werden kann.	x
0	18_128_2015-10-02	Ob Spracherwerb, der Aufbau sozialer Netzwerke oder die berufliche Ausbildung: Bildung ist ein zentraler Baustein für Integration.	x
1	18_128_2015-10-02	Kolleginnen und Kollegen, die Integration der Geflüchteten ist eine Chance für unser Bildungssystem.	x
2	18_128_2015-10-02	Es gibt viele Unternehmer, die Asylsuchende einstellen oder ausbilden wollen.	3
3	18_128_2015-10-02	Nicht jeder Asylsuchende hat bereits eine Ausbildung oder ein Studium abgeschlossen, zum Beispiel weil ein Großteil noch sehr jung ist.	x
4	18_128_2015-10-02	Das widerspricht nicht nur unserer persönlichen politischen Ethik, darüber hinaus ist Integration auch ganz einfach in unserem eigenen Interesse, wenn wir weiterhin als Nation stark und wettbewerbsfähig sein wollen.	3
5	18_128_2015-10-02	Wir sind ein Einwanderungsland.	x
6	18_128_2015-10-02	Sprachkurse und Beratungsangebote – eine Situation, die übrigens in den meisten Ländern der Welt bis heute so ist.	x
7	18_128_2015-10-02	Es war die unionsgeführte Bundesregierung, die Integrationspolitik maßgeblich konzeptionell entwickelt hat.	x
8	18_128_2015-10-02	Bereits seit vielen Jahren setzt die unionsgeführte Bundesregierung bei der Integration auf den Bildungsbereich.	x
9	18_128_2015-10-02	Vielleicht können Sie von den Zuwanderern in Landeskunde schon sehr bald lernen, ich sehe da durchaus Bedarf.	x
10	18_128_2015-10-02	Erstens wird in beiden Anträgen für junge Geflüchtete und Geduldete der Schutz vor Abschiebung in der Ausbildung gefordert.	2.5
11	18_128_2015-10-02	August 2015 wurde für jugendliche und heranwachsende Geduldete, die eine qualifizierte Berufsausbildung aufnehmen, für die Dauer der Ausbildung ein Schutz vor Abschiebung erreicht.	2.5
12	18_128_2015-10-02	Nach drei Monaten sollen nach Ihren Vorschlägen faktisch alle Asylberechtigten BAföG bekommen können.	x
13	18_128_2015-10-02	Welchen Sinn macht es, dass gegebenenfalls Menschen BAföG erhalten, die mit hoher Wahrscheinlichkeit wieder ausgewiesen werden?	2.5
14	18_128_2015-10-02	August 2015 eine Änderung beschlossen, mit der jungen Asylsuchenden und Geduldeten, die gute Bleibeperspektiven haben, der Zugang unter anderem zu berufsorientierenden und studienbegleitenden Praktika erleichtert wird.	x
15	18_128_2015-10-02	Die bewährten Integrationskurse werden für Asylbewerber mit guter Bleibeperspektive geöffnet, und die hierfür vorgesehenen Mittel werden entsprechend dem gestiegenen Bedarf aufgestockt.	x
16	18_128_2015-10-02	Es geht darum, Sprach- und Integrationskurse weiterhin zu betreiben.	x
17	18_128_2015-10-02	Sprache ist aber auch ein Schlüssel für gelungene Integration.	x
18	18_128_2015-10-02	Wie Sie wissen, wurde jahrelang gesagt – ich habe das persönlich zu spüren bekommen –, dieses Land sei kein Einwanderungsland.	x
19	18_129_2015-10-14	In New York haben wir darüber diskutiert, welche Instrumente die VN eigentlich zur Verfügung haben, um Fluchtursachen zu bekämpfen und zur besseren Lastenteilung beizutragen.	x
20	18_129_2015-10-14	Zu Recht haben kritische Stimmen angemerkt, dass der Einsatz gegen Schlepper auf dem Mittelmeer nicht weit genug geht.	2.4
21	18_129_2015-10-14	Mit einer Einigung mit Libyen bestünde die Möglichkeit, die Mission von internationalen Gewässern auf die libysche Küste auszuweiten und die Schlepper, die aus dem Schicksal der Flüchtlinge ein Geschäft machen, noch effektiver zu bekämpfen.	2.2
22	18_129_2015-10-14	Halten Sie das nicht für eine Entscheidung, die die schnelle Integration durch Qualifizierung und Arbeit eher konterkariert als fördert?	x
23	18_129_2015-10-14	Aber Flüchtlingspolitik, die auf eine Bekämpfung von Fluchtursachen zielt, kann doch nicht in der Absicherung und Abschottung einer Grenze in Zusammenarbeit mit dem türkischen Militär bestehen, auch nicht in dem Vorhaben, die Türkei zum  Staatsminister Michael Roth  Deutscher Bundestag – 18.	x
24	18_129_2015-10-14	Wenn wir jetzt mit der Türkei über die Flüchtlingskrise, die Eindämmung von Fluchtursachen und gemeinsame Strategien im Syrien-Konflikt verhandeln, dann müssen wir das mit Respekt und auf Augenhöhe tun, aber wir müssen uns auch fragen lassen, wer eigentlich die legitimen Ansprechpartner sind.	x
25	18_129_2015-10-14	November in den Wahlkampf der Türkei – und dann auch noch auf der falschen Seite, nämlich bei denen, die die personifizierte Fluchtursache sind – eingreifen.	x
26	18_129_2015-10-14	Dann würden Sie gerade in der Flüchtlings- und Einwanderungsfrage in Deutschland zu differenzierteren Erkenntnissen kommen, Herr Özdemir.	x
27	18_129_2015-10-14	Über diesen Demokratiegedanken sollten Sie einmal nachdenken, bevor Sie eine Einwanderungspolitik betreiben, die jedermann Tür und Tor öffnet und nach dem Mund redet.	x
28	18_129_2015-10-14	Die Gefährdung der Demokratie in Deutschland durch die Einwanderungspolitik der Grünen ist für uns Grund zur Sorge.	4.3
29	18_129_2015-10-14	Die Türkei als Transitland ist ein wichtiger Akteur in der Region.	x
30	18_129_2015-10-14	Die EU-Aufnahmerichtlinie 2003/9/EG wurde in Deutschland in innerstaatliches Recht umgesetzt und ist von Ländern und Kommunen bei der Unterbringung von Asylsuchenden zu beachten.	x
31	18_129_2015-10-14	Die Richtlinie legt in Artikel 14 fest, dass Asylsuchende in geeigneten Räumlichkeiten untergebracht werden, die unter anderem den Schutz des Familienlebens gewährleisten, dass in Unterbringungszentren dafür Sorge getragen wird, dass Gewalt verhütet wird, und dass das dort eingesetzte Personal angemessen geschult ist.	x
32	18_129_2015-10-14	Auf Basis welcher Datenlage kann die Bundesregierung nach ihrer Kenntnis bestätigen, es sei „eher noch untertrieben”, dass 30 Prozent der syrischen Asylsuchenden in Wahrheit keine syrischen Staatsangehörigen seien, obwohl es keinerlei belastbare Zahlen zur größenmäßigen Einschätzung hierzu gibt (Fernsehmagazin Panorama vom 9.	4.2
33	18_129_2015-10-14	Hinweise, die darauf schließen lassen, dass Migranten aus anderen Ländern zunehmend angeben, syrische Staatsangehörige zu sein, ergeben sich beispielsweise aus Lageerkenntnissen von FRONTEX.	4.2
34	18_129_2015-10-14	Anteil nicht schutzbedürftiger Asylsuchender und dem Anstieg der Straftaten gegen Asylbewerberheime vor.	x
35	18_129_2015-10-14	Gewalt gegen Asylsuchende ist unter allen Umständen zu verurteilen.	1.3
36	18_129_2015-10-14	Oktober 2015: „Seehofer: Flüchtlinge sollen an der Grenze zurückgewiesen werden”), per Beschluss des bayerischen Kabinetts „Maßnahmen der Notwehr” ergreifen zu wollen, etwa Asylsuchende an der Grenze zu Österreich zurückzuweisen bzw.	x
37	18_129_2015-10-14	Schengener Grenzkodex, die Europäische Menschenrechtskonvention, die Dublin-Verordnung, EU-Asylrichtlinien, die Zuständigkeit für den Grenzschutz usw.)?	x
38	18_129_2015-10-14	Oktober 2015 (vergleiche Council of the EU, Press Release 711/15, Punkt 17) umzusetzen, in Drittstaaten sichere und tragfähige Aufnahmekapazitäten zu schaffen, auch um Asylanträge von Flüchtlingen von dort nach Artikel 33 der EU-Asylverfahrensrichtlinie 2013/32/EU als unzulässig einstufen und die Betroffenen dorthin ohne vorherige Asylprüfung zurückschicken zu können, und wie sieht die Bundesregierung die Realisierungschancen konkret in Bezug auf die Türkei vor dem Hintergrund, dass nach Artikel 38 der Asylverfahrensrichtlinie unter anderem gefordert wird, dass es in dem betreffenden Drittstaat möglich sein muss, Schutz nach der Genfer Flüchtlingskonvention (GFK) zu erhalten, was in der Türkei wegen des regionalen Vorbehalts zur GFK nur für europäische Flüchtlinge möglich ist (bitte ausführlich darlegen)?	x
39	18_129_2015-10-14	Rückkehrpolitik ist integraler Bestandteil und wichtiges Steuerungsinstrument der Migrationspolitik.	4.2
40	18_129_2015-10-14	In diesem Zusammenhang ist auch die in den oben genannten Ratsschlussfolgerungen vorgesehene Prüfung durch die EU zu sehen, ob es möglich ist, in Regionen in unter Migrationsdruck stehenden Drittstaaten sichere und dauerhafte Aufnahmekapazitäten zu schaffen und Flüchtlingen und ihren Familien langfristige Perspektiven und angemessene Verfahren zu bieten, bis sie in ihre Herkunftsländer zurückkehren können.	x
41	18_129_2015-10-14	Die Frage, ob Asylanträge von Personen aufgrund des Konzepts des sicheren Drittstaats gemäß Artikel 33 Absatz 2 Buchstabe c) der Richtlinie 2013/32/EU als unzulässig bewertet werden können, hängt davon ab, ob die Voraussetzungen des Konzepts des sicheren Drittstaats gemäß Artikel 38 der Richtlinie 2013/32/EU erfüllt sind.	x
42	18_129_2015-10-14	Aufgrund der großen Herausforderungen durch den starken und anhaltenden Anstieg des Asylbewerberzugangs in Deutschland haben sich Verzögerungen im Umsetzungsprozess leider nicht vermeiden lassen.	4.1
43	18_129_2015-10-14	Die Bundesregierung arbeitet intensiv an der Umsetzung der beiden Richtlinien 2013/32/EU (Asylverfahrensrichtlinie) und 2013/33/EU (Aufnahmerichtlinie).	x
44	18_129_2015-10-14	Welche Rückschlüsse zieht die Bundesregierung aus einem Bericht des TV-Magazins Frontal 21, nach dem der EU-Militärausschuss von einem Scheitern der Phase 2 des EUNAVFOR-MED-Einsatzes ausgeht, die den bewaffneten Einsatz gegen Schlepperboote beinhaltet (www.zdf.de/frontal-21/schleuserjagd-im-mittelmeer-die-unmmögliche-mission-der-bundeswehr-kampf-gegen-schlepper-40410638.html)?	x
45	18_132_2015-11-04	Wir müssen jetzt verstärkt nach Afghanistan abschieben.	2.5
46	18_132_2015-11-04	Das heißt, man wird bei abgelehnten Asylbewerbern in der Regel weitere Schutzgründe nach der EMRK verneinen, oder man wird behaupten, es gebe innerstaatliche Fluchtalternativen.	x
47	18_132_2015-11-04	Darauf kommt es bei der Frage an: Können wir sie guten Gewissens dahin abschieben oder eben nicht, weil sie dort nicht sicher sind?	2.5
48	18_132_2015-11-04	Deshalb meine konkrete Frage: Was unternimmt das Außenministerium in diesem Kontext, um für eine eindeutige Aufenthaltserlaubnis für diese Menschen zu sorgen?	2.2
