	Term_NDoc_Date	Sentence	Frame
25	18_121_2015-09-10	In meinem Wahlkreis habe ich erlebt, dass Menschen schon seit Monaten aktiv bei der Integration der Flüchtlinge in ein für sie komplett fremdes Land und in einen neuen Alltag helfen.	2.3
26	18_121_2015-09-10	Wir setzen das Programm „Schwerpunkt-Kitas Sprache & Integration“ fort.	x
27	18_121_2015-09-10	So wünschen wir uns auch mehr professionelle Pflegende mit Migrationshintergrund.	3.3
28	18_121_2015-09-10	Wir brauchen einen Einstieg des Bundes in die Finanzierung, um Unterbringung und Integration zu ermöglichen bzw.	x
29	18_121_2015-09-10	Sie haben viel zur Integration gesagt.	x
30	18_121_2015-09-10	Das wäre eine Integrationsmaßnahme.	x
31	18_121_2015-09-10	Sie haben viel von Integration geredet.	x
32	18_121_2015-09-10	Von uns wurden schon wichtige Themen angesprochen: Sprache, Integration, „Frühe Chancen“.	x
33	18_121_2015-09-10	Wir haben weiterhin Maßnahmen im Bereich der Integration von Sprachförderung über das Programm „Schwerpunkt-Kitas Sprache & Integration“.	x
34	18_121_2015-09-10	Integration bedeutet nicht nur, dass ein paar hinzukommen.	4
35	18_121_2015-09-10	Vielmehr heißt Integration, dass sich die Gesellschaft fortlaufend verändert.	x
36	18_121_2015-09-10	Integration von Anfang an, so früh wie möglich, (Beifall bei Abgeordneten der CDU/CSU und der SPD) so zielgenau wie möglich und so bedarfsorientiert wie möglich.	3.5
37	18_121_2015-09-10	Denn die Integration wird nur dann gelingen, wenn die Menschen, die sich jetzt zu Recht engagiert einbringen und die Situation als Chance für unsere Gesellschaft sehen, erkennen, dass die Politik in dieser Phase handelt.	x
38	18_121_2015-09-10	Unsere Kanzlerin hat in der gestrigen Generaldebatte sehr prominent zu Beginn ihrer Rede betont, dass die Integration für sie und die Regierungsparteien allerhöchste Priorität hat.	x
39	18_121_2015-09-10	Unser Einzelplan 17, meine sehr geehrten Damen und Herren, bietet sich für Integration geradezu an.	x
40	18_121_2015-09-10	Bereits mit dem Nachtragshaushalt 2015 haben wir im Kinder- und Jugendplan wegen der Flüchtlingsproblematik 8 Millionen Euro für die Jugendmigrationsdienste und 4 Millionen Euro für die C1-Sprachkurse aufgesattelt, gemeinsam mit den Kollegen der Union.	x
41	18_121_2015-09-10	Das ist ein Zuzug von Menschen, die weder unser Verständnis von Freiheit noch von Grundrechten kennen, von Menschen, denen unsere Kultur, unsere Gebräuche und unser Leben bisher weitgehend fremd waren.	4.3
42	18_121_2015-09-10	Denn das hat nicht nur etwas mit Baustandards oder Verteilschlüsseln zu tun, es hat auch nicht immer etwas damit zu tun, wie wir das Asylrecht gestalten oder was wir als sichere Herkunftsländer benennen, sondern es hat vor allen Dingen etwas damit zu tun, wie wir die Integration vorantreiben.	x
43	18_126_2015-09-30	Entwurf eines Asylverfahrensbeschleunigungsgesetzes und Verordnung zum Asylverfahrensbeschleunigungsgesetz	x
44	18_126_2015-09-30	Die Bundesregierung hat als Thema der gestrigen Kabinettssitzung mitgeteilt: Entwurf eines Asylverfahrensbeschleunigungsgesetzes und Verordnung zum Asylverfahrensbeschleunigungsgesetz.	x
45	18_126_2015-09-30	Es gibt viele Maßnahmen zur Verbesserung der Versorgung von Asylbewerbern: Impfungen, psy Deutscher Bundestag – 18	x
46	18_126_2015-09-30	Die Leistungen dieser Gesundheitskarte werden aber von Beginn an auf dem abgesenkten Niveau des Asylbewerberleistungsgesetzes erfolgen.	x
47	18_126_2015-09-30	Daneben findet sich in dem Gesetzentwurf ein Beschäftigungsverbot bei offensichtlich unbegründetem Asylantrag.	x
48	18_126_2015-09-30	Dazu gehören der Zugang zu Sprachkursen, der Zugang zu Berufsförderungskursen sowie eine bessere Vernetzung zwischen Integrationskursen und berufsbezogenen Sprachkursen.	x
49	18_126_2015-09-30	Dazu gehören viele Dinge, mit denen wir ermöglichen, dass die Integration nicht durch lange Verfahren in Erstaufnahmeeinrichtungen oder anderswo verzögert oder für später erschwert wird.	x
0	18_126_2015-09-30	Wir brauchen mehr Geld für Integrationskurse.	x
1	18_126_2015-09-30	Wie kann es sein, dass sich die Bundesregierung mit diesem maßgeblichen Urteil zu den Leistungen nach dem Asylbewerberleistungsgesetz nicht einmal auseinandersetzt?	x
2	18_126_2015-09-30	Wie wird beim Bundesamt und bei den entsprechenden Behörden sichergestellt, dass der Personenkreis, der in den entsprechenden Staaten nicht politisch, sondern wegen seiner ethnischen Herkunft oder seiner sexuellen Orientierung verfolgt wird und deswegen Zuflucht in der Bundesrepublik Deutschland sucht, ein entsprechendes ordnungsgemäßes Verfahren in der Bundesrepublik Deutschland erhält, politisches Asyl bekommt und nicht in die Heimatstaaten abgeschoben wird?	4.2
3	18_126_2015-09-30	Wir sind aber verpflichtet, zwei EU-Richtlinien umzusetzen: eine sogenannte Aufnahmerichtlinie und eine Asylverfahrensrichtlinie.	x
4	18_126_2015-09-30	Sie wollen  ja nicht nur im Vorhinein festlegen, wer eine Chance auf das Grundrecht auf Asyl hat, um entsprechend auszusortieren, sondern Sie wollen die Flüchtlinge auch länger in Erstaufnahmeeinrichtungen unterbringen.	4
5	18_126_2015-09-30	Das bedeutet aber erst einmal für alle eine sehr viel längere Zeit in großen Lagern – es sind eher kasernierte Unterbringungen –, was die Möglichkeiten der Integration für die Dauer dieses Aufenthalts völlig verhindert.	x
6	18_126_2015-09-30	Wie ist das mit beschleunigten Integrationsverfahren vereinbar?	x
7	18_126_2015-09-30	Für die Gruppe der Asylsuchenden, die länger als 15 Monate in Deutschland sind, sehen Sie jetzt dankenswerterweise die Möglichkeit einer besseren psychologischen Betreuung vor.	x
8	18_126_2015-09-30	Ferner wissen wir, dass die Integration dadurch beeinträchtigt wird und diese schwerwiegenden Erkrankungen durch den Aufenthalt in großen Einrichtungen massiv verstärkt werden können.	x
9	18_126_2015-09-30	Ich habe darüber auch mit Pro Asyl schon viel diskutiert.	x
10	18_126_2015-09-30	Das zweite Argument ist: Wir müssen die großen Lasten, die mit einer solch großen Zahl von Asylbewerbern verbunden sind, fair zwischen den Bundesländern aufteilen.	4.1
11	18_126_2015-09-30	Das soll nicht mit einem Durchschnitt nivelliert werden, sondern es gibt im Nachhinein eine Spitzabrechnung pro Asylbewerber pro Bundesland.	x
12	18_126_2015-09-30	Wir lesen ja in der Begründung – im Gesetz leider nicht, weil Sie da auf eine Verordnung verweisen –, dass die Integrationsleistungen denen zur Verfügung stehen sollen, deren Antrag auf Asyl voraussichtlich Erfolg haben wird.	x
13	18_126_2015-09-30	Wir haben doch im Augenblick schon genug zu tun, überhaupt das Asylverfahren voranzutreiben.	4.1
14	18_126_2015-09-30	Jetzt muss dann quasi im Vorverfahren des Asylverfahrens geprüft werden, ob das Asylverfahren gute Aussichten auf Erfolg hat, oder wie muss ich mir das praktisch vorstellen?	x
15	18_126_2015-09-30	Jetzt zeigt aber die aktuelle Anzahl von Asylanträgen, dass die Asylanträge dieser Flüchtlinge höchstens 10 Prozent ausmachen.	4.2
16	18_126_2015-09-30	Zweitens kommt hinzu, dass wir noch aus dem ersten Halbjahr sehr viele Verfahren und abgelehnte Asylbewerber, also Entscheide des BAMF, haben, wo es noch keinen Vollzug gibt.	x
17	18_126_2015-09-30	Wir sind uns ja bei allen Differenzen über konkrete  Punkte in diesem Gesetz einig, dass wir schnellere Asylverfahren brauchen, um schneller zu entscheiden, wer bleiben darf und wer am Ende gehen muss.	4.2
18	18_126_2015-09-30	Vorschläge zur Behandlung von Asylanträgen von Menschen aus Staaten mit hoher Anerkennungsquote – man könnte Gruppenverfahren machen – oder eine Finalisierungsregelung zur Lösung von Altfällen, bei denen wir ewig lange Verfahren haben und wissen, dass wir die Leute am Ende des Verfahrens sowieso nicht wegschicken werden.	x
19	18_126_2015-09-30	Wenn sich ein Bundesland entscheidet, diese Karte auszugeben, erfolgen die entsprechenden Leistungen nach dem Asylbewerberleistungsgesetz, und es sind nicht, wie irrtümlich kundgetan wird, normale Leistungen der Versichertenkarte.	1.1
20	18_126_2015-09-30	Nach jetziger Rechtslage ist es so, dass bei Asylbewerbern im Vergleich zu anderen das Niveau der Gesundheitsversorgung geringer ist.	1.1
21	18_126_2015-09-30	Deswegen ist im Gesetz vorgesehen, dafür Vorsorge zu treffen, dass auch bei Nutzung einer solchen optionalen Gesundheitskarte das Leistungsniveau demselben abgesenkten Niveau wie bisher nach dem Asylbewerberleistungsgesetz entspricht.	x
22	18_126_2015-09-30	Standardabweichungen werden geregelt, das Asylbewerberleistungsgesetz und das Asylverfahrensgesetz werden novelliert, und außerdem wird die zukünf Bundesminister Dr. Thomas de Maizière  Deutscher Bundestag – 18.	x
23	18_126_2015-09-30	Ich spreche hier ganz bewusst die Praxis in SchleswigHolstein und Thüringen an, die im Winter letzten Jahres auf Abschiebungen verzichtet haben.	4.2
24	18_126_2015-09-30	So darf etwa die Aussetzung der Abschiebung nicht länger als für drei Monate erfolgen.	4.2
25	18_126_2015-09-30	Am Ende eines Asylverfahrens steht die Entscheidung, ob die entsprechende Person hierbleiben darf oder das Land zu verlassen hat.	4.2
26	18_126_2015-09-30	Vielleicht können Sie noch einmal aufführen, welche konkreten Maßnahmen jetzt anstehen, um die Abschiebungen zu beschleunigen.	4.2
27	18_126_2015-09-30	Was halten Sie von dem Gedanken einiger Länder, zum Beispiel Thüringens, die Verantwortung für die Abschiebung auf die Landkrei se zu delegieren?	4.2
28	18_126_2015-09-30	Die Asylbewerber aus sicheren Herkunftsländern sollen möglichst bis zum Schluss der Verfahren in den Erstaufnahmeeinrichtungen verbleiben, von wo aus sie dann in ihr Land zurückkehren können oder abgeschoben werden.	4.2
29	18_126_2015-09-30	Das Nächste ist, dass keine Abschiebung länger als für drei Monate ausgesetzt werden darf.	4.2
30	18_126_2015-09-30	Man muss auch nicht immer nur abschieben.	4.2
31	18_126_2015-09-30	Flüchtlingen mit Bleibeperspektive, einer Lehrstelle und einer garantierten Übernahme durch den auszubildenden Betrieb noch für mindestens zwei Jahre nach Ende ihrer Ausbildung einen gesicherten Aufenthaltsstatus in Deutschland und Schutz vor Abschiebung zu gewähren?	4.2
32	18_126_2015-09-30	Zum einen sollen die Mittel der Bekämpfung von Fluchtursachen dienen.	4.2
33	18_126_2015-09-30	Thomas de Maizière, bei Spiegel Online vom 21. September 2015, „Asylbewerber: De Maizière entschärft geplante Kürzungen für Flüchtlinge“) -, gerade im Hinblick auf die Studie des Deutschen Instituts für Menschenrechte „Effektiver Schutz vor geschlechtsspezifischer Gewalt - auch in Flüchtlingsunterkünften” von 2015, und welche Maßnahmen wird die Bundesregierung ergreifen, um den spezifischen Bedarf von besonders schutzwürdigen Personen, zum Beispiel abschließbare Hygieneräume, zu berücksichtigen?	2.2
34	18_126_2015-09-30	Das Bundesamt für Migration und Flüchtlinge (BAMF) befragt die Asylbewerber im Rahmen ihrer Antragstellung auch zu den Aspekten Bildung und Ausbildung.	x
35	18_126_2015-09-30	Sie geben aber einen Eindruck vom Bildungshintergrund der Asylsuchenden.	x
36	18_126_2015-09-30	Von den insgesamt circa 105 000 hierzu befragten Asylsuchenden im Alter von über 20 Jahren gaben 13 Prozent an, eine Hochschule besucht zu haben, 17,5 Prozent ein Gymnasium, und 30 Prozent gaben an, eine Mittelschulbildung zu haben.	x
37	18_126_2015-09-30	Mit Blick auf die derzeit größte Gruppe von Antragstellern, die syrischen Asylbewerber, ergibt eine Auswertung der Daten von insgesamt mehr als 28 000 Personen folgendes Bild: Rund 62 Prozent der syrischen Asylbewerber erklärten, aus durchschnittlichen oder sogar guten wirtschaftlichen Verhältnissen zu stammen.	x
38	18_126_2015-09-30	Für eine Integration dieser Gruppe, die gegenwärtig alle einen Flüchtlingsstatus in Deutschland zugesprochen bekommen, ist dies eine gute Voraussetzung.	x
39	18_126_2015-09-30	Günter Krings auf die Frage des Abgeordneten Dieter Janecek (BÜNDNIS 90/DIE GRÜNEN) (Drucksache 18/6136, Frage 43):  Welchen Stellenwert misst die Bundesregierung dem Beitrag der Unternehmen zur gesamtgesellschaftlichen Aufgabe der Integration von Flüchtlingen bei, und sieht die Bundesregierung dieses Potenzial voll ausgeschöpft trotz Festhaltens an der Vorrangprüfung und dem zeitlich befristeten Beschäftigungsverbot für Flüchtlinge in der Leiharbeit?	x
40	18_126_2015-09-30	Die Bundesregierung misst dem Beitrag der Unternehmen zur Integration von Asylbewerbern mit einer Bleibeperspektive und Flüchtlingen einen hohen Stellenwert zu, da die staatlichen Integrationsmaßnahmen durch die sozialen Kontakte bei der Arbeit und im Arbeitsumfeld die Integration erheblich fördern können.	x
41	18_126_2015-09-30	Zudem lockert die Bundesregierung das bisherige Leiharbeitsverbot für Asylbewerber und Geduldete und verknüpft dieses mit der Vorrangprüfung.	x
42	18_126_2015-09-30	Die Änderungen haben zur Folge, dass Asylsuchenden und Geduldeten eine Beschäftigung als Leiharbeitnehmer grundsätzlich offen steht, wenn die Bundesagentur für Arbeit der Beschäftigungsaufnahme ohne Vorrangprüfung zustimmen kann.	3.1
43	18_126_2015-09-30	Die Vorrangprüfung selbst und die Prüfung der Vergleichbarkeit der Beschäftigungsbedingungen tragen den Interessen der inländischen Arbeitsuchenden Rechnung und leisten damit einen Beitrag zur Akzeptanz des grundsätzlichen Arbeitsmarktzugangs für Asylbewerber und Geduldete.	x
44	18_126_2015-09-30	Entscheidungen über Asylverfahren, die seit dem 1.	x
45	18_126_2015-09-30	Bediensteter hat die Bundesregierung in Bezug auf die  genauen rechtlichen Grundlagen des Aufenthalts der nach § 60 a des Aufenthaltsgesetzes (AufenthG) geduldeten Personen (bitte Gesamtzahl nennen und unter Nennung des jeweiligen Absatzes und Satzes des § 60 a AufenthG angeben, wie viele Personen jeweils den dort aufgeführten Duldungsgründen unterfallen), und welche Erkenntnisse oder Einschätzungen fachkundiger Bediensteter hat sie zu Anzahl und Status der nach § 1 Absatz 1 Nummer 5 des Asylbewerberleistungsgesetzes leistungsberechtigten Personen (bitte Gesamtzahl nennen und soweit möglich genauer nach jeweiligem Status auflisten)?	x
46	18_126_2015-09-30	Die letzten verfügbaren statistischen Daten zur Gruppe der Leistungsbezieher nach § 1 Absatz 1 Nummer 5 des Asylbewerberleistungsgesetzes beziehen sich auf den 31.	x
47	18_126_2015-09-30	Damals waren von den insgesamt 362 850 Leistungsbeziehern nach dem Asylbewerberleistungsgesetz 12 950 leistungsberechtigt nach § 1 Absatz 1 Nummer 5 des Asylbewerberleistungsgesetzes.	x
48	18_126_2015-09-30	Der Bundesregierung sind lediglich die Ausführungen im Bericht des EU-Koordinators für die Terrorismusbekämpfung bekannt, dass die EU-Meldestelle für Internetinhalte an drei Forschungsprojekten zur Beobachtung offener Quellen und zum Entdecken von Propaganda teilnehmen will.	x
49	18_127_2015-10-01	Ich bringe heute den Entwurf eines Asylverfahrensbe­ schleunigungsgesetzes für die Bundesregierung ein.	x
0	18_127_2015-10-01	Dazu zählt, dass für diejenigen, die nicht ausreisen, die aber vollziehbar ausreisepflichtig sind, kein Anspruch mehr auf Asylbewerberleistungen besteht.	4.2
1	18_127_2015-10-01	Ein zentraler, wichtiger Baustein dieses großen Pakets ist die Beschleunigung der Asylverfahren.	x
2	18_127_2015-10-01	Jetzt werden die Prozesse in den Asylverfahren nochmals verbessert.	x
3	18_127_2015-10-01	Dort lie­ gen die Voraussetzungen für Asyl nur in wenigen Ein­ zelfällen vor.	x
4	18_127_2015-10-01	Dafür schaffen wir le­ gale Zuwanderungsmöglichkeiten für Menschen aus den Balkanstaaten – unter bestimmten Voraussetzungen.	x
5	18_127_2015-10-01	Wem in unserem Land ein Asylantrag abgelehnt worden ist, der muss, wenn es sonst keinen Grund für Duldung gibt, unser Land verlassen.	4.2
6	18_127_2015-10-01	Hilfe vor Ort in den Flüchtlingslagern, Hartz IV, Kosten für das Bundesamt für Migration und Flüchtlinge, Kosten für die Bundespolizei, Integrations­ kurse – viele Aufgaben, die auch der Bund zusätzlich zu lösen hat.	4.1
7	18_127_2015-10-01	Und dennoch: Der Bund beteiligt sich dauer­  haft, strukturell und dynamisch an den Kosten, die durch die Aufnahme von Asylbewerbern in Ländern und Kom­ munen entstehen.	4.1
8	18_127_2015-10-01	Längere Asyl­ verfahren gehen dann nicht mehr zulasten der Länder.	x
9	18_127_2015-10-01	Mit dem Gesetzespaket bekennen wir uns genauso klar und deutlich zur Aufnahme und Integration derje­ nigen, die schutzwürdig sind und dauerhaft hier bleiben werden.	x
10	18_127_2015-10-01	Wir erweitern das Angebot von Sprachkursen.	x
11	18_127_2015-10-01	Wir lockern das Leiharbeitsverbot für Asylbewerber.	x
12	18_127_2015-10-01	Neben der Spra­ che ist Arbeit der Schlüssel zur Integration.	x
13	18_127_2015-10-01	Kolleginnen und Kollegen, Integration hat zwei Richtungen.	x
14	18_127_2015-10-01	Wenn wir mit unseren Bürgern über eine Willkommenskultur sprechen, müssen wir von denen, die zu uns kommen, auch eine Anerkennungskultur ein­ fordern.	4.3
15	18_127_2015-10-01	Wir brauchen ein einheitli­ ches EU­Asylrecht, auch bei Verfahren und Leistungs­ standards.	x
16	18_127_2015-10-01	Wir werden keines der Probleme auf der Welt lösen können, indem wir unbegrenzten Zuzug nach Europa erlauben und diesen einfach nur besser organi­ sieren.	4.1
17	18_127_2015-10-01	Wir müssen die Fluchtursachen angehen und dazu beitragen, dass sich nicht noch mehr Menschen auf den  Weg machen.	x
18	18_127_2015-10-01	Über 60 Anschläge auf Asylunterkünfte sind beschämend.	1.3
19	18_127_2015-10-01	Ich habe im Bayerischen Fernsehen erlebt, wie ein Iraner, der in Bayern lebt, erklärte, dass er vor zwei Jahren einen Asyl­ antrag gestellt hat.	x
20	18_127_2015-10-01	Mein Haupt­ anliegen ist, dass zum Abschluss des Asylverfahrens die Zahlung beendet wird.	x
21	18_127_2015-10-01	Was ist mit all den Geduldeten, denen, die kein Asyl bekommen, aber auch nicht wegge­ schickt werden können?	4.2
22	18_127_2015-10-01	Wir müssen in erster Linie die Fluchtursachen bekämp­ fen.	x
23	18_127_2015-10-01	Wenn man dann aber einem 17­jährigen jun­ gen Mann gegenübersteht, der erzählt, wie er auf seiner Flucht aus Eritrea vor Gewalt und Verfolgung tagelang ohne Wasser durch die Wüste geirrt ist, wie er von be­ trunkenen Schleppern verprügelt wurde und noch vieles andere mehr erlebt hat, dann wird deutlich, welche Di­ mension dieses Leid wirklich hat.	2.4
24	18_127_2015-10-01	Für die Perspektive eines selbstbestimmten Lebens ist es wichtig, dass ein schnellerer Zugang zu Sprach­ und Integrationskursen für Menschen mit einer guten Blei­ beperspektive beschlossen wird.	1.1
25	18_127_2015-10-01	Ich möchte ausdrücklich auch Ihnen, Herr Minister, dan­ ken, dass Sie am Montag all jenen THW­Helferinnen und ­Helfern gedankt haben, die ehrenamtlich zum Bei­ spiel dafür sorgen, dass vor Ort, wo es darauf ankommt, Unterkünfte entsprechend ausgestattet und Sprachkurse angeboten werden.	x
26	18_127_2015-10-01	Das öffnet die Tür zu einem Einwanderungsge­ setz, jedenfalls ein kleines Stück.	x
27	18_127_2015-10-01	Aus diesem Einwanderungskorridor muss aber dann endlich ein modernes Einwanderungsgesetz wer­ den.	x
28	18_127_2015-10-01	Sie versuchen, das Asylrecht an verschiedenen Stellen zu schwächen, und zwar auf Kosten der Flüchtlinge.	2.1
29	18_127_2015-10-01	Hier muss entsprechend bestraft und gegebenenfalls auch ausgewiesen werden.	4.2
30	18_127_2015-10-01	Als Erste hat sie einen Flüchtlings­ und Integrationsgipfel initiiert.	x
31	18_127_2015-10-01	Wir beraten heute die bedeutendste Reform des deut­ schen Asylrechts seit den 1990er­Jahren.	x
32	18_127_2015-10-01	Oktober 201512278  (A) (C)  (B) (D)  dürftig sind, den Anreiz nehmen, überhaupt einen Asyl­ antrag in Deutschland zu stellen.	x
33	18_127_2015-10-01	Die Leistungen werden nach Abschluss des Asyl­ verfahrens deutlich gekürzt, und der Antragsteller wird direkt aus der Erstaufnahmeeinrichtung in sein Heimat­ land zurückgeschickt.	4.2
34	18_127_2015-10-01	Wer keinen Anspruch auf Asyl hat und dennoch in Deutschland einen Asylantrag stellt, der muss in seine Heimat zurückgehen, und zwar rasch.	4.2
35	18_127_2015-10-01	Die Integration der Flüchtlinge wird nur gelingen, wenn wir als aufnehmende Gesellschaft eine klare Vor­ stellung davon haben, was wir brauchen und was wir nicht brauchen, und wenn wir klare Ansagen machen.	4.3
36	18_127_2015-10-01	Alle anderen haben nichtsdestotrotz ein individuelles Recht darauf, nach unserem Grundgesetz jedenfalls immer noch, hier einen Antrag auf Asyl zu stellen.	1.1
37	18_127_2015-10-01	Menschenwürde ist nicht verhan­ delbar, auch nicht zum Zweck der Migrationspolitik.	1.1
38	18_127_2015-10-01	Jetzt kommt aus Bayern der Ruf, sogenannte Transitzentren an den Grenzen einzurichten.	4.1
39	18_127_2015-10-01	Wir haben eine rechtliche, eine menschliche Verpflichtung, unser Asylsystem nach allen Kräften des Staates und der Gesellschaft arbeitsfähig und funktionsfähig zu halten.	x
40	18_127_2015-10-01	Unser Asylrecht kann nur dann effektiv wirken, wenn wir seine Grenzen respektieren, Grenzen, die trotz aller mensch­ lich möglichen Anstrengungen erkennbar in Teilen er­ reicht und überschritten sind.	x
41	18_127_2015-10-01	Der Gesetzentwurf des Bundesinnenministers schwächt nicht das Recht auf Asyl.	x
42	18_127_2015-10-01	Der Dreh­ und Angelpunkt ist aber die – entschuldi­ gen Sie den Ausdruck – naive Annahme, man könnte durch Gesetz beschließen, Menschen länger in Erstauf­ nahmeeinrichtungen zu lassen, weil sie aus sicheren Her­ kunftsstaaten kommen oder Asylfolgeantragsteller sind.	4.2
43	18_127_2015-10-01	Was wir heute auf den parla­ mentarischen Weg bringen, ist die umfassendste Reform unseres deutschen Asylrechts seit dem Asylkompromiss in den 90er­Jahren.	x
44	18_127_2015-10-01	Es ist herausragend, was in Deutsch­ land derzeit passiert und wie viel Solidarität und Empa­ thie gegenüber den Flüchtlingen und Asylbewerbern an den Tag gelegt wird.	2.3
45	18_127_2015-10-01	Was die Registrie­ rung, Antragstellung und Antragsbearbeitung anbelangt, ist dies eine riesige Herausforderung, und die Unterbrin­ gung sowie die Integration in unsere Gesellschaft und in den Arbeitsmarkt sind auch für ein starkes und wohlha­ bendes Land wie Deutschland auch bei größter Anstren­ gung auf die Dauer nicht zu leisten, wenn die Zahlen auf diesem hohen Niveau bleiben.	4.1
46	18_127_2015-10-01	Meine sehr verehrten Damen und Herren, allein im September sind mehrere zehntausend Flüchtlinge und Asylbewerber nach Deutschland gekommen.	4.1
47	18_127_2015-10-01	Jeder Flüchtling und jeder Asylbewerber muss schnellstmöglich, wenn er  Deutscher Bundestag – 18.	x
48	18_127_2015-10-01	Wenn Deutschland an Leistungs­ und Integrationskraft einbüßt, ist letzten Endes nieman­ dem geholfen.	x
49	18_127_2015-10-01	Wir geben mit diesem Gesetz zur Beschleunigung des Asylverfahrens ein wichtiges Signal an all die Menschen, die nicht schutzbedürftig sind, sich nicht nach Deutsch­ land aufzumachen.	x
0	18_127_2015-10-01	Es geht nicht um eine Differenzierung in schlechte und gute Flüchtlinge, sondern darum, ob je­ mand überhaupt Flüchtling oder anerkannter Asylbewer­ ber ist oder ob er es nicht ist.	4.2
1	18_127_2015-10-01	Es geht darum, die Asylverfahren zu beschleunigen, die Unterbringung zu erleichtern und gleichzeitig die Ab­ schiebung abgelehnter Asylbewerber zu forcieren.	4.2
2	18_127_2015-10-01	Auch das gehört zu einem geordneten Asylver­ fahren und zur Realität in diesem Land.	x
3	18_127_2015-10-01	Ich bin davon überzeugt, dass wir so als Gesamtstaat die Problematik und den Ausnahmezustand beim Thema „Flüchtlinge und Asylbewerber“ bewältigen werden kön­ nen.	1.5
4	18_127_2015-10-01	Wenn man das Ergebnis mit dem schlechten Asylkompromiss von 1993, wenn ich das einmal sagen darf, vergleicht, dann kann man feststellen: Wir haben in  Eckhardt Rehberg  Deutscher Bundestag – 18.	x
5	18_127_2015-10-01	Oktober 201512288  (A) (C)  (B) (D)  der Asylpolitik jetzt einen riesigen Schritt gemacht, der unser Land voranbringen wird.	x
6	18_127_2015-10-01	Es ist die schlimmste Verschärfung seit 1993 im Asylrecht!	x
7	18_127_2015-10-01	Wir sollten uns überlegen, welche wirtschaftliche Not sich oftmals dahinter verbirgt, wenn Menschen alles auf­ geben, wenn sie ihre Kinder nehmen und sich auf den Weg machen, auch wenn sie bei uns kein Asyl bekom­ men können.	2.4
8	18_127_2015-10-01	Wir sorgen jetzt dafür, dass die Integra­ tionskurse auch für Menschen, die sich im Asylverfahren befinden und eine gute Bleibeperspektive haben, sowie für Geduldete geöffnet werden.	x
9	18_127_2015-10-01	Die  Zahl der Sprachkurse wird erheblich erhöht.	x
10	18_127_2015-10-01	Wir wissen, dass Flüchtlinge aus den Ländern des Westbalkans in den weitaus meisten Fällen kein Asyl be­ kommen, weil sie nicht verfolgt sind.	4.2
11	18_127_2015-10-01	Oktober 2015 12291  (A) (C)  (B) (D)  ten wollen, eine legale Möglichkeit der Arbeitsmigration, damit sie keine Asylanträge stellen.	x
12	18_127_2015-10-01	Wenn es uns gelingt, dass Asylverfahren deutlich schneller entschieden werden, dass die deutsche Sprache schnell erlernt werden kann, dass Qualifikationen erfasst und Praktika und Ausbildung angeboten werden, dann können wir diese Herausforderung meistern.	1.5
13	18_127_2015-10-01	Gerade in der Situation, in der wir uns jetzt befinden, einer Situ­ ation, in der überall Flüchtlinge sind, brauchen wir die Integrationskraft der deutschen Wirtschaft.	x
14	18_127_2015-10-01	Wer über Fluchtursachen und deren Bekämpfung reden will, der darf natürlich beim Thema Handelspolitik nicht schweigen.	2.1
